date,title,url
2025-05-28,NVIDIA Announces Financial Results for First Quarter Fiscal 2026 - NVIDIA Newsroom,https://news.google.com/rss/articles/CBMioAFBVV95cUxNMURCbGxxelhudC1RVnFEYzVfYWhRNVBCZ1BRdW8tQ09YcmwzTE0wM0tWX3MyMTZkYmhEZ2ZpY2hiTWJUMC1HQnl1b1hxRzF2cTZzMHlRU3F3UU1ta1pibW8xZ21BTzF0UHlpNFltdElKcGhka2V1djZSc2xKcFRjTWR6ekIycWhTV2s3LWpaYS1aNG42amhIMHNVYVNyRVRT?oc=5
2025-01-06,NVIDIA Blackwell GeForce RTX 50 Series Opens New World of AI Computer Graphics - NVIDIA Newsroom,https://news.google.com/rss/articles/CBMiswFBVV95cUxQY2JJcXRZeEN0VG9pT2Vwd0RadTd1MkFiTjFfbmpISFB1YTJCUkYyeXBob1RsdzZTT3o5NWRKWWNPMkpZM2V4U3VxTFFlcnBMZnRNbDVWNjFjSTZKLXRUcktPelY4cURTcC1HYXdQQUhvVUpVT0NBMWJvMDJCb0JiMm9iUzhKUk5vSlpEYXphTmJjbXYxVUtFUWRVV1JxUUJmLTIyT3I3ZkhmQ3Q1QUM1LTJJRQ?oc=5
2023-05-28,NVIDIA ACE for Games Sparks Life Into Virtual Characters With Generative AI - NVIDIA Newsroom,https://news.google.com/rss/articles/CBMirwFBVV95cUxQaGdySHZhcWxNRElXR0hjVXZZLTdPZ1Bhc1IwX0VxMFpjOFVtTGFBSk1RTDBUelFzZVNQVVdYV3oyX3pTWHJZSjZPMVVMbzNuZzFZbmdBYUtld3dYb21NcDYtWnlxUlZGejlvUl8yZXNuSFpYLXNrRVJUamNjYXRpR0hVZmZraG5nR2tCMmFUOG8wVEQwMXNSTWFqNE04T2tTX0Z1N21vTnpLN2dnX0hN?oc=5
2024-03-18,NVIDIA Blackwell Platform Arrives to Power a New Era of Computing - NVIDIA Newsroom,https://news.google.com/rss/articles/CBMiogFBVV95cUxOczF5bzhxRFgzM1lwaC1reFBBdV81VzFpM1JocmpWRVBFMlM2MHZRdGhCVEk5YzBkRXR4NTlWSk5WN29qVXowOWtzeG5lX01ma1RpU2tRU3QzMGFUQmpLelBLMEtlSEc0X3VPU3VneGRVclhxSHRZc2lYLXpQbjJja2kyTVZWZDJ0X2RQUVVPblZLbFMxX2U2RGNGNmZMT3RMRXc?oc=5
2024-11-12,NVIDIA App Officially Released: Download The Essential Companion For PC Gamers & Creators - NVIDIA,https://news.google.com/rss/articles/CBMigAFBVV95cUxOaFREOWJ6Tm44UTZDd1VmTmJ5U0p4MXVJXzQ4bEY1LWR1MnQxalBWeUZyV1pQeFJxM3R3UkJialdYZzJUdHNpdXRpQmxEUElUXzEzZnBWaS1jR25IYnpvYmIyc0djU0NPQjZXdUF3UVJZa1o5Z0lSdnhtWlRQUjBOWA?oc=5
2024-11-20,NVIDIA Announces Financial Results for Third Quarter Fiscal 2025 - NVIDIA Newsroom,https://news.google.com/rss/articles/CBMioAFBVV95cUxORVRTS0xyVXRjd2h5M1VLZ3B1aWpaVkd6WWtWR2dNcjNMQ1hzaTdLZ1B1OVJkcjFQWm5wcXdnc3hTU1dGUVJFMUpOMXAxZFFxNFZqcEhRbHcxTGxfVXU5Um5FM29CaGtDMlppMVZWYmJ5NjBOT0MxSTNQb0lPSFJ1TzNyU1RaZFMxRU45RTNrRTZnNUZhLVgtODI0d1BJaEdI?oc=5
2024-08-28,NVIDIA Announces Financial Results for Second Quarter Fiscal 2025 - NVIDIA Newsroom,https://news.google.com/rss/articles/CBMiogFBVV95cUxPX3JXMExqclZfcUlCNmxSbWNTdE5kZnBDdTZKOXhId0JsWERnVWFLVkVGcUtncGktcGZhN0tORU92cTdpejZWYTNKZVRCeF9PTkowMWZSdEZxdnJ0enROLXo3OHhvX3VNbWNQblBVVl85T3RHdER2S0paU2I5VDRoSExpa3FEbmFWNHV0NjRsZXh4ZlpuMEY0ajBJa2xnUVVFcUE?oc=5
2025-05-18,NVIDIA Unveils NVLink Fusion for Industry to Build Semi-Custom AI Infrastructure With NVIDIA Partner Ecosystem - NVIDIA Newsroom,https://news.google.com/rss/articles/CBMipgFBVV95cUxQX295dC0zLXRyZEEzTWJoVXZfT291TG1JUUttOVlrZS1oNVZKRjFod3VUVWJEbDZnNTRnSEpZbVQ0V2stN0NCaG9neHh0RW9WcmhRQ2FxU2xFemNiT0QwdGNiM1M1MkZPMWZhaFl3ZkIyS0dxVzJJOHJuSEVLS1puRmRTWTllNVdGVTZUX0pEUUlOVFVFU3IzaE9pOGtLX3pfZjNrQjZB?oc=5
2025-01-06,NVIDIA Puts Grace Blackwell on Every Desk and at Every AI Developer’s Fingertips - NVIDIA Newsroom,https://news.google.com/rss/articles/CBMitAFBVV95cUxOZ21PYy1MQ1NqR2dRWWhoSE9TU0I3VTViZGwxeEpBUy1pRXhrUjl0UVVvT2dONkpuVDhvU29ZN2NKWXNoRnFYb3Y0Y0RNOC1sRmVHLXhWTEFZSExMQ05Cc3F5SWZzZXZLc3kycGRqcHZEVi1xZnpwZ3BvMDhYbUZNRHkwOE5VVVY5RTF1aWpVbjFQR1I0d1lfb0hrMXFCRHlfYnNqNmJBclRTLVVjNkFZWjZDUXc?oc=5
2025-03-18,"NVIDIA Blackwell RTX PRO Comes to Workstations and Servers for Designers, Developers, Data Scientists and Creatives to Build and Collaborate With Agentic AI - NVIDIA Newsroom",https://news.google.com/rss/articles/CBMilgFBVV95cUxOMV9QVi1tcFF1Wk9sQ1JiU3NTSGNIZFdlOHE0UFRSV2syWDFqVWEzbFRJMG5RcFhKVXNlZC10eGJsUFVpR3BJYmhYUU40MFlHVXlEYWlmbGszZnJhbms0SjBraHhWaWl5SlR6aGJUaXhLRGUyZV9ldkVwQVdfM1pVS1FaeTRjSXdhNnpodnNPOHJVR2hWZ3c?oc=5
2025-01-13,NVIDIA Statement on the Biden Administration’s Misguided ‘AI Diffusion’ Rule - NVIDIA Blog,https://news.google.com/rss/articles/CBMiUkFVX3lxTE5ZWjRkbHctalQyU2NLS2R1aVpoQUJXQkczUFNVeGVuTmtUeVA4d20yLUk1ZHNNWU1yT0NLelVQSk9uZXJZQUdWS0podm9vYlY0bXc?oc=5
2025-04-14,NVIDIA to Manufacture American-Made AI Supercomputers in US for First Time - NVIDIA Blog,https://news.google.com/rss/articles/CBMijAFBVV95cUxPdWlkNFpoc1Nkc3pXZjV2cnV0UTBpM3hJU251Tml2bWFCUE5hRHF2X3ltbnlEd2xVcFRMLVZBNG5LbkNHUDltRFpSUGM0VngtVDlxNVZtQ0hUSXRpa1Yydlp4dWpQSmsyOGRGdHBuTEpnMHhHa1lZTmlDVTZtR1htMW9helZvNVlTT3E5TQ?oc=5
2025-03-18,NVIDIA Announces DGX Spark and DGX Station Personal AI Computers - NVIDIA Newsroom,https://news.google.com/rss/articles/CBMioAFBVV95cUxPenJaMWFzd2lMNnFFNWVsdHBrdW5vNHplMWVDdUd5M0xadjNuNW9Bd2ZIRVpxQnNFSl9KS1ZERVBUWGRGdEhMTHJUbG94cEN2SXVvMkZ5c21RNGttcV81RzRlQUFxZkpEMjMzTG51ejRjX2g3TU42Sk1CUHVoZVRTUEl4b1VrWjdoNkVYWV9uWXV2azROYm9ISkNMazlvcTM4?oc=5
2024-10-01,"NVIDIA App Beta Adds G-SYNC Controls, RTX HDR Multi-Monitor Support & More | GeForce News - NVIDIA",https://news.google.com/rss/articles/CBMipgFBVV95cUxOQnhhS2R4cVo5Q1FGMkViaDFpeTdzVXlrVGNySlJxYnBMeVFLSEpkekUzcjNzUnpiZElJZlNkUi1NVEQwcWdWT1N1dUM2NlZQbFVETkF5LVlaU3ZoMWFZNjEwdmdyOXpuSVM0UWlJT2lFbGNpcnkyNEdEb0hUV1l2TVBtX2tiRV9XZnJ3VTIwaDNBbnpsT1dFTlN2SE1NOVp4WEdrWTln?oc=5
2024-11-07,Welcome to GeForce NOW Performance: Priority Members Get Instant Upgrade - NVIDIA Blog,https://news.google.com/rss/articles/CBMif0FVX3lxTE02cGFrNl9qX0NtWU9YQUNLYUpoV3oxR1BjRUVKTmVXdElTZGVFeE12d2N6N2hzNExnZGRQM3Zsdk93OFNUX2ZpNUx3N3Y1VkdSdlVsck5uQW5aRFRIZUNfdVE2UjdrQ2FiWkFZbmdYbU9SVG9LNTBmQTUyY0EyNEE?oc=5
2025-01-06,NVIDIA Launches Cosmos World Foundation Model Platform to Accelerate Physical AI Development - NVIDIA Newsroom,https://news.google.com/rss/articles/CBMixgFBVV95cUxObksySUZlancyRHo2X1kwMUhzQTdaMjFmNU5ENnRCRDQydldmRWhpa1VUcW9KOVNaTkFhdW5Gc1M5RGVuaDJsWHQ4b042TTVUeVNGd2t0ZFNPNHNEQWM1OU1DMlVkeDFSLW9fOGFjRUhsb3dBbVprbHFIc0JGRmR0QVBrNWc5aXp0dU1LdE5ZS05taHhFblIwMjlld1BCYUdRRW9rdUFmN1hfTkhidVFMenU4UEpMWDFKM1hKQ1NHTmFJSWRvc1E?oc=5
2025-01-06,"CES 2025: AI Advancing at ‘Incredible Pace,’ NVIDIA CEO Says - NVIDIA Blog",https://news.google.com/rss/articles/CBMiYkFVX3lxTFBYc3Fnczh3UXhyQkFMUGk0S1pPUHJreGdSd3AtUWR6NkVVSTNzXzdMZGNYdVR3TGlVU3BfOFJqR1pOcHdaSXdGRGZCd3hJY0NMMGpJbjhiRDhXRDJockVWNk53?oc=5
2024-06-02,NVIDIA Brings AI Assistants to Life With GeForce RTX AI PCs - NVIDIA Newsroom,https://news.google.com/rss/articles/CBMimgFBVV95cUxPbHQ4U1NrWjJLR0VCWkF5NG8yLWd5dDRSaVZTOFJFbFc4bjBxSUdXaUlWUF9qM2U5dkhqNGtsTGV4SmlwTFFaLTNpUUZxdHVkcUltZHJwdnVSLUFCdzhlN3FJVmNZNjVHaTg5cnVsaXVrUXo4VmtNR0drQTltS1ctaXFvMC1FR1hFY1JrTVJMVFlkODlxaUZuV1dR?oc=5
2025-03-18,General Motors and NVIDIA Collaborate on AI for Next-Generation Vehicle Experience and Manufacturing - NVIDIA Newsroom,https://news.google.com/rss/articles/CBMi0AFBVV95cUxQZzd6aUZUaUdDX3pZdmRZNWtMNGZnQmNoRmF0U1ItWDMzbFlJb2drODRIa2tKM09xNU93Qk9nMkZqZndZX0UzUWRZUi1PUmRpMER0RHdYTGJycUVubDVkVXd1X1ExN0ttQU9Xd2hZN1Z5c0pGYnJ3UW51Y2lfYkFDSXljVE1UcnVyR3R4SEFNVWplN0lzdjlZbUZFVzBHQXNtS0xYcGd2WWdDVDdlYVJSZHU5d1d1bEE2S2pqZEV2VGkwRl9qVXdIT1VrZkFFTzNX?oc=5
2025-03-18,NVIDIA Announces Isaac GR00T N1 — the World’s First Open Humanoid Robot Foundation Model — and Simulation Frameworks to Speed Robot Development - NVIDIA Newsroom,https://news.google.com/rss/articles/CBMitgFBVV95cUxPYmVwQTl4THVvMXZreTI2eEFRdW1rTEVNdnpmVHA2RldONDVzQ0ZySWNjRG81TnRXUDhZdHkwZ0wwakw4N2ZIRzgtaWxPN196LTZuVDhaczBXTk96SldjSlQxQ0NmbzZCM1p6b2RITDBUR2hCdzZPT1hVaEpMblAyQ1BuN1VIazNORlJiS0E2SGZxYnJuUlRaeFQydTdiVElnYkQzdE5jRGxOOGxDdkJIa3BVdGd0Zw?oc=5
2025-01-13,"NVIDIA Partners With Industry Leaders to Advance Genomics, Drug Discovery and Healthcare - NVIDIA Newsroom",https://news.google.com/rss/articles/CBMivwFBVV95cUxNSmRrMzFkZDI3aHBEQnVMY09RSXpoSnQtblpUck9sbTljRjdTSlczU19WZ3NtemZqV3FDMW9pQVFGbXdvRXI4WS1mblpxTUN6QlZKcG5icDJ1RzF1eHZKS2tOZ3MtTEtSSlZnMlA3WURVZWFlWkFPTDR0T3BkUFB1RXFHT2JGWjBaZ1ZKbWRvTkVGbmtQZHFVQmRiSWYwQlpDVWhTeFRKZ2ZvRExEbDNQN3pGclJlbmlkQmE2RXVubw?oc=5
2025-03-18,NVIDIA Dynamo Open-Source Library Accelerates and Scales AI Reasoning Models - NVIDIA Newsroom,https://news.google.com/rss/articles/CBMisAFBVV95cUxNbmVlaWhiVm13Vl9BS3Zoa3g0b0E5QzNRQzd2Yk16MG5UVUh3SEZKVTNxWEVNRmRLZkxUc0dLaVVaNHlGSzRjamRISWlCUDkxRU9DNV9ZWWc2Nm1SQmRSckg3YTlua3poR2FSTENfXzhqYlFaR25nTWZJRE54NmZFVkgtdC1yM25VdzJkRDBuTmw1YXd0d1EtQUhkUWs3NDVuR2VwNFhaNWtDZXV0cW9JRA?oc=5
2025-01-06,NVIDIA DLSS 4 Introduces Multi Frame Generation & Enhancements For All DLSS Technologies | GeForce News - NVIDIA,https://news.google.com/rss/articles/CBMijwFBVV95cUxOWlFaV0FXRmRBX2N2OVh5MkFZNHpFT2hna2h3U0p3SUk2RHh4ZWJPeks1dkFWcTFCZUVFVHV5N3pOTDFFVzlBYmhfRGlUSGZqdkpROWJNOXNQSEhQeWVXM1RXa1FYM3NvdmN1ZVZiYVpIQ0FXbXhweWtxMzlVTTJYQjV4SS1hLXdjbUFPQU9HZw?oc=5
2024-12-17,NVIDIA Unveils Its Most Affordable Generative AI Supercomputer - NVIDIA Blog,https://news.google.com/rss/articles/CBMic0FVX3lxTE5tTGlKLVU0akd5emRXQ3oxRC10UEJ2SjJLN2tkUUh6cHM4SWljTS1YRGluc1dnSXdLdGFBVFd5WlpFOUU4OVZQQU9DaTBfdXpIb0ZvOTRLNExIUWltdS1WZUNGbzJUU3NLcFZtbDY0OWRjVnM?oc=5
2025-05-29,RTX on Deck: The GeForce NOW Native App for Steam Deck Is Here - NVIDIA Blog,https://news.google.com/rss/articles/CBMif0FVX3lxTE9mc3R6LUxqZW9ENTQ0dFBvYTdSVlgtZE5sdUI1VTE5WTd1TnBQNXY5UFBERUxIZXZELTdXMnR2Y2hlTlB1VVFZMVpOb2VNMXlUdDFyR0N0U2ZNZEZtS1FZeVo5WG43VXh4MVdpTzl1dTZib09iVUlTV0pPRFp4T1E?oc=5
2024-06-02,"‘Accelerate Everything,’ NVIDIA CEO Says Ahead of COMPUTEX - NVIDIA Blog",https://news.google.com/rss/articles/CBMiaEFVX3lxTFBNVE51RVY5ZjhXQldMeV9lNF8tYnRhdUdqbl9Nd2RxenBqLWN0cS1PRFBTYjFCaXVQQ1NhTk9jS2pzWDFhdm9TWnpDd2tyZEp5cUJGXzE5LVdKblA3Y1RLYTRsV0VCRVRE?oc=5
2025-03-18,NVIDIA Blackwell Ultra AI Factory Platform Paves Way for Age of AI Reasoning - NVIDIA Newsroom,https://news.google.com/rss/articles/CBMisAFBVV95cUxNTk1WeEdzYTZnX1ExNk9jTi1HYVZsM0xZRV9lNXJ4X3N2RHBLakI3VWR5Z2lMYlM2YUExbG1YeEdUeWFJYWZ0RWtsaGFiMWQxWXBVRHNHNW9yU2lzQTRadTVjN2stdGxwV09pTUlQTlBYRWlJekdGUlBtSmduMmZNOEFxU2RENVo0Q2NVMHZKRjZfdkpiLVlZWUpIZDEtVkNiS0dGdHNzWkFKNjByYThjSg?oc=5
2025-01-06,NVIDIA Launches AI Foundation Models for RTX AI PCs - NVIDIA Newsroom,https://news.google.com/rss/articles/CBMijwFBVV95cUxOQXF5aWVYMmp5Mjd2X3A1anhMWFlGQU1DQmJZS3RSRzE3d1FRbUV3WkR0RXlOQ1dWTkI5c3h1Yk82SE9yb3FhbGVJQUlrd1dBaUxyUXQ1WjhOc3QzLXJtV2RvS25KeGQxRGNIdW1OTkF2MDU5QXduNzFVTHVwYUp6N3dpZ21sVnU1NEw3eHlOQQ?oc=5
2025-01-06,PC Gaming in the Cloud Goes Everywhere With New Devices and AAA Games on GeForce NOW - NVIDIA Blog,https://news.google.com/rss/articles/CBMiYEFVX3lxTE1sb2JGVmJGdW1FU2JKYUJPOW5NNEtPNGlmUHUxSnN3eklWWjMxbUE4ZWExYTNDSDRWZGVhWElyN1pXenljV0ZLaWluT1hFN2JBWVJVQzdpSHZtS09QbXVzWA?oc=5
2024-10-28,"NVIDIA Ethernet Networking Accelerates World’s Largest AI Supercomputer, Built by xAI - NVIDIA Newsroom",https://news.google.com/rss/articles/CBMihAFBVV95cUxPNUFTOXJoX2c4NS1Uc2xpX1NEdUROTGJCVjJRV3ZPOHNXUlVmQ2oxQzNGU2ZaVlg5SFZDWTdUZE9WZm9SUERBUUNmZ3plYjFTaWhTRkh2cWVjTElaeU1pQ1R1cWg5SzJjbjA1U0pVNEN5djlRaTQ0WUhjakNXYXg0Z3RISTA?oc=5
2024-07-09,Widescreen Wonder: Las Vegas Sphere Delivers Dazzling Displays - NVIDIA Blog,https://news.google.com/rss/articles/CBMiW0FVX3lxTE9TSEN4S2xES2p6MEE4VzNnUjlySzR4WXoxVmwxdEhOOFVJUjBBdkdkZzliVWgwdl9FRVRJRWRiMmNjU1ZRM2puVjRqS1FWT1EtcDY5Yk5jYVlPWXc?oc=5
2024-07-29,NVIDIA Accelerates Humanoid Robotics Development - NVIDIA Newsroom,https://news.google.com/rss/articles/CBMimAFBVV95cUxQMDZkaGRFQ3FTVUZHNjIxTTFKVEoxallOeW5kNG5QQ01LVVpEN3ZMem5NbGhubDdjenRicFg4R2ZDUUljRmIyV2E0Q3ZzLVNLVDNaVVBsQno0bDF0dmdmR1U3ekxoQVhuZF8zSGdma3d4QWhJVUQxc0dGb2k4YmtlNmNuOVNmSnUxcmlDWUE1YzY0eGtOYnBQVw?oc=5
2025-01-06,"DLSS Multi Frame Generation & New RTX Technologies Coming To Black State, DOOM: The Dark Ages, Dune: Awakening, and More. 75 Games and Apps At Launch & More On The Way - NVIDIA",https://news.google.com/rss/articles/CBMimAFBVV95cUxQRjNBZ0s5WG03MFR3V1F2bW9abmNSa3cwZWpnOHJYRzRnUE92VEx5dVhLU3IydzdsN2RYVXpIckpxTDl3TkVjdEEyYzljQXZBZHQ3OU0zZGJwX2Z2TEprdGdVeHhZek9CdktJRUcxczl0RWFlakRzaDFEMG5jX3ZhLU5uMzBJVXBKTy1QZW5YOWdmYWxucE1tZw?oc=5
2025-01-06,NVIDIA Redefines Game AI With ACE Autonomous Game Characters | GeForce News - NVIDIA,https://news.google.com/rss/articles/CBMiowFBVV95cUxOZERXcmxSb3VPOUh1eDF3d0NzamQ4dWRXcmJyYmY0czZKMFcwUmswSm5WVUh5U0xlNEVMR3BEUW9kOGNRakdOdWQwbzdVVzdLZnRjdXl2SHRnX1BFaS1VOExtVDJKWkpSRnhrUzEzZmgxU0QzVDY1cm5FRDAzLWRnMVRGeTl3UC1BTlZOdGM4ODRwUFVoLUV4THZIdlUyMFBmaU9z?oc=5
2025-03-18,NVIDIA and GE HealthCare Collaborate to Advance the Development of Autonomous Diagnostic Imaging With Physical AI - NVIDIA Newsroom,https://news.google.com/rss/articles/CBMi4gFBVV95cUxQbi03T3BaMmJTM3JNbEMtX3pBTGZyRlpaSXlVQ19QWm1yOC1tOEJtR01JOXdlLWRnUjB4YWxmQ3pLVzN4bmdoeGhZWkVFcklvbWRfeUczczl3WVNvVFNCMzlST3N5YzFmWVZmcjlCdlc2NUh1TWJ2cjZlSUh4ZlRBMS1SUFpTeVoyX3FlRHVuWGdudl94N2lmSkNZYmZRNUZNNkxVUjZKSkNFbU52WEFCZjJtLUl4cnBwMjF5Wnlwek9CTGRIQ1BjNktwY01USmtXeEYyWUpMa0RwNWlaZF95TmtB?oc=5
2025-04-15,"NVIDIA Blackwell GeForce RTX Arrives for Every Gamer, Starting at $299 - NVIDIA Newsroom",https://news.google.com/rss/articles/CBMipgFBVV95cUxOMHc4dXpkZlRRMWp1Vk5pMEdEY01aemJmNnZDUXZ5NVA5WlVSQVJXdUZnMmlPMlhPTmJuSjh2enFRUk4xbFRIbXYzSkxXdWhqSDJYdFdWS1oxRHZzcmd6YkxWRWRWaFBxZVBrNldHM1lRX0RuTGE4ZHplanFYV1ZCTzFRQUtfWkZqQ3hCVXEyeWdWSkZJUHgyVE1vbUJOV2c1THU0dTV3?oc=5
2025-04-03,Nintendo Switch 2 Leveled Up With NVIDIA AI-Powered DLSS and 4K Gaming - NVIDIA Blog,https://news.google.com/rss/articles/CBMiowFBVV95cUxQVGg1dlhncml4em14dV9tZnRlXzU5MERDaEpOVzgwelNBb0ZaOGZwcVNOTE5ISnpmeHl1dFA3eU1INGxfZThRSkRQbzJlU1h5aGxIR19iVjJpanMyTTBRaHZJSU4yZFpiNE1xSWpoV1M2TVdBT2s3QV9aazREN19lVTc0NUJkUmpxWDQtbDBSZTR0eUxJVWczbm9teUJJaHI3RXpn?oc=5
2025-03-18,NVIDIA Omniverse Physical AI Operating System Expands to More Industries and Partners - NVIDIA Newsroom,https://news.google.com/rss/articles/CBMivAFBVV95cUxQeWRRNl83R1NwRTVucTVrZGl0blhlclhWZjRGS014WDNmTEwzZUdjUjNSSVVvSVNkUzZ0Q0ZpX2lBMzJJcWdTemwwYzV3NDlOVi1JaFpZQ2FjNi1CdWJ2SjNLMnZQUEpmSnh0eWN5ZmRxRl9XY1I3THBSaGxnSmVtbUI0SFZZTjU1N3R0T1dlbGpjR0lkUDV4SjhjN19Yd0ZxVC1NdGp0R3BFaC1ZNEl4TUl3dFMwQ1BaekFlNw?oc=5
2024-05-22,NVIDIA Announces Financial Results for First Quarter Fiscal 2025 - NVIDIA Newsroom,https://news.google.com/rss/articles/CBMioAFBVV95cUxQclk1bTBCcnZoaEZxdHRRSmticG9Kd0NhTkdzWGliX1Z0NEZYRTVlVzNVVEhfNzh2bGUyc0N6Zkx6U1djMmQ5TUR5eGFMWnNhNjhhSUQ3N0NCcjRNckJhVk1laGJCZURIUk1lY0xITFdicFJoTDNIcWU5ZTY3LUFmbmJHMnlvbHFKbVBJUzgyaS1SUGE0NGdqajJuQjA4N3VO?oc=5
2025-03-18,NVIDIA and Telecom Industry Leaders to Develop AI-Native Wireless Networks for 6G - NVIDIA Newsroom,https://news.google.com/rss/articles/CBMitwFBVV95cUxPa204WUxmN2piU1czUlBYbW0zX1hHMkZsVmlFQ21xS25hM3FjRGJlVXE4OXZITWpnb0tlTldqT1hMQXhhM3R5WjVMaXhUSjY5YzY4VWlaR05lekhUMkx1OGZ3RFQtQmhiZWRfOEg0aXI0WHA3ZXdJU0pOUVUyTXgyN250dU90UVFKSkFXcHVjZDNuS1JIV3lTcmNPaWR0T2h5a2NzckRxUnJkbHoxa1ROeXFCN1RWdW8?oc=5
2025-01-06,New GeForce RTX 50 Series Graphics Cards & Laptops Powered By NVIDIA Blackwell Bring Game-Changing AI and Neural Rendering Capabilities To Gamers and Creators - NVIDIA,https://news.google.com/rss/articles/CBMinAFBVV95cUxNWWxmRkhGaUs5cUstSHVFalJ0cGhQb241QURpNy05eVFSaml3cmtVbGxUaWJ6OEp0d1Y5WjJ5ZlVMVmlzeEJlNUdKcWFkYXEzeC12QVcwYVpVSW1sNklMRENTN052LVZ3MmJYNXFJajVaLVJsd0puTjZ1Qi0teFhTX3VhYU1oMXN2RmtUS2NUdVFpbmE1WHc3bDRjWjg?oc=5
2024-11-12,NVIDIA and SoftBank Corp. Accelerate Japan’s Journey to Global AI Powerhouse - NVIDIA Newsroom,https://news.google.com/rss/articles/CBMipwFBVV95cUxNVWx4MFVoTU9iNXJuOFpEaEtleHlzSy1JR3lCWWtodE1ETXpEb3QwWmFJMWwtM2JFUGdaVTh1eDVCWk5KUVh4RTNQb0ZSMjRnaWlvZU5tVFdZN0V3WTE4ZXVGMGREUTZ2a1B6U1dZTDNDMzZLUUdVbnhGZmZxRDVBcGFOcVV3Tmtic25YamlMdHpNUHl0dzg5OHJfMXd6REI1TE4zbU1xbw?oc=5
2024-10-11,Game-Changer: How the World’s First GPU Leveled Up Gaming and Ignited the AI Era - NVIDIA Blog,https://news.google.com/rss/articles/CBMiX0FVX3lxTE4tRm1LZGRDMmxwSTBtTUp3SUVva1M3bXlqeXBWVDZEYVBUSE1pQ0ViQkJBS3FuUTFqXy1kdDZJVEZ2MThDdGhqNVhkR1o1V2QtTy1jMUVBZjlhOXQwbHJV?oc=5
2025-03-18,NVIDIA and Storage Industry Leaders Unveil New Class of Enterprise Infrastructure for the Age of AI - NVIDIA Newsroom,https://news.google.com/rss/articles/CBMizwFBVV95cUxPQ3J6ZWFqai10aFNnNGZQdmxVMGdYLVNKd29wckdEZTNzY256eDNvZFQ4U08wUFZzUHRCLS1UOUhtWFJWa1hlWHQyUDZkbGRjbGhQd1JNUjRaRkZWb1VfdmxQam10azF6N0NmbFZGN0tsT3JMdkNzLVNzZ3BpUGVaaUNYRnJHVVZ5Yk1IRzhBbEw4Vl85Vk5NZkh4MlBHY2J3VnNLeWpMWE9kX3l5RUVmYUxvbnhxcmJwY0lKUHdxQ0w3SFBpTVJOVGlyZVdNNG8?oc=5
2025-01-10,NVIDIA Announces Blueprint for AI Retail Shopping Assistants - NVIDIA Newsroom,https://news.google.com/rss/articles/CBMimwFBVV95cUxPbWstZnFHSlpqMEJFNDVZNGtlbGRzM0I2bzJYb3FabHhPT3BiY01oa0N5czBiNVEzUkdUdXVBZjZkVzI0ZWV3enRJb3Nha3UxNUJodXctWFo5MG5PNTdubUpIeDhPLVhXdTVwUEJ6Q3hHNC1ZWEZsU2FXX3RMX2ZVRmlQbkgwZzlTdXJwU1MzZm15UXN6ZmE2S1R4TQ?oc=5
2025-01-30,"NVIDIA App Update Adds DLSS 4 Overrides, New Broadcast Update, Improvements To RTX Video Super Resolution & More | GeForce News - NVIDIA",https://news.google.com/rss/articles/CBMijAFBVV95cUxPQklDekZDZGdTZXRFRy1oblhGTVZpWmtySHdESVV5VlYwZE5sTEY3N2kyYVNDVS1PWVZIUmp4cy0xNVp2RGZQVUs3RVNNdUtwRWFXdlEzaU8yeXRQOEdkSFZxOXRCQU83TnI0bjVXUUlqM2o4QTNzb2lOeHppVjltUTJ1aEJNM214QVVVTA?oc=5
2025-03-18,NVIDIA Announces Major Release of Cosmos World Foundation Models and Physical AI Data Tools - NVIDIA Newsroom,https://news.google.com/rss/articles/CBMixAFBVV95cUxPQXljUXlHdEYwdkZYVFUzeTNyajlSTVRGdVBTcS1TX2VpUUY4UVllMVMwVkNJanNybUJBd2R5QUp4dk4yWmp1amRCZXRCZDdMcU9OTjhhTUlrRG9pUTljOUlVLXM2SFdkTk5HTHowcUpuX2gxSi1nOURwSGlKUUhEMFhTbDU0V0tWWF9fT2FvejZUcDExWklIWEtmajhsaVdMQllCaVROdm02bEliblF2cTl1MWJYeExpUnFkb1ZWdE8wUms0?oc=5
2024-08-06,"NVIDIA App Beta Adds RTX Video Super Resolution, RTX Video HDR Sliders, and Display Settings - NVIDIA",https://news.google.com/rss/articles/CBMimwFBVV95cUxOZmZ2WVZpM2ZrRVdmYVFhWFNIYWRDeU4tVlNNYzl0U0FnQk1aSjFZWWphYUlqcU90a2dfT0JOSG1BSUFoRjUxSGE4U2s5UUJoU19peXpySVEwVTlqZWdjN2U2X3N1RTRmVTBBWXlXYWstaW15VlpLZDZqZ3ZKenloY0xUbGhtY1RBdDJuMkhEODREdk9wUGRiSEdiNA?oc=5
2024-06-02,NVIDIA App Beta Update Adds AV1 Recording & One-Click Performance Tuning - NVIDIA,https://news.google.com/rss/articles/CBMikgFBVV95cUxPMndvSU4zOXBjbjJ2ckk1RDF0cDZ0M1FlZS1BbmhTbFQ3eWVqZXloaDRiNjVET3ByckVxcTJpcXl2WDVBYjA3QVR2MFd3Z2g0ZFJQdDFVT3B6ejhlM0NyZzFfaWtiYVBzWm56YWhBNWMzNGFXYldsbEh4WUlzdnJTU05FVW9odWhzTlVqbGJuZVpMZw?oc=5
2025-01-30,"NVIDIA DLSS & GeForce RTX: List Of All Games, Engines And Applications Featuring GeForce RTX-Powered Technology And Features - NVIDIA",https://news.google.com/rss/articles/CBMifEFVX3lxTE1KZG1wdC1JaHdWT0p3VmJqUUVWMGo4VXgydHZMZWk5dXdmaU10QUxScG0yNGxScktBdzVPQXNoa2dWYTE0b0xxQURkZDFDbk5LMFlHdEJMQ3pfNG5hNFhJR2l2dkVNekh5dWktWFY5U2RRVi10QlA4UjMyNkQ?oc=5
2024-06-02,Computer Industry Joins NVIDIA to Build AI Factories and Data Centers for the Next Industrial Revolution - NVIDIA Newsroom,https://news.google.com/rss/articles/CBMihAFBVV95cUxQODFhSU1ZXzQxVTN0LS1XWXoyY29aUVA4NXUtSmdNekdBYTBFMXhxenZqekVmeEZqRGVveXZkNUlmN3dGbHNSRkJVOFItdVQ0WU9ROTZpVmlYSkk4eVdFbC0yN2hPVHRKN3B3bXc0TUNuRUhJeVVSSmhFSzRCb0RnNVNaLVI?oc=5
2024-11-18,NVIDIA Accelerates Google Quantum AI Processor Design With Simulation of Quantum Device Physics - NVIDIA Newsroom,https://news.google.com/rss/articles/CBMixwFBVV95cUxNQkJZR0Z1S3Q1Q2RvcERweHpsZEFRNHZHT3VYemVrd1IzV08wd3BzUnBVdkxyMTVwMGRhczdmc3V5dE84c0xsUURzZG13dnVNLTlaUXk0ZVdMeHh2WVpsZV9GTjVoYUVsR1ItSU9EWXhfaXJTMFFaZWhKR3YzXzVBVHhXR2NpZ192bGdKTm5MLVBKS1JsRWNsQndydDNXcVdnZTNDcEM1dWlfZFhxci1nQ1ZISUZKSkhacnFSYXZXdnVYMURQdmhF?oc=5
2024-11-25,Now Hear This: World’s Most Flexible Sound Machine Debuts - NVIDIA Blog,https://news.google.com/rss/articles/CBMiaEFVX3lxTFBBRTBuUmswYkxPSmk3aEpGa1h3ZGZEOFU3RnlkSHZtM3dORlFOcWFvZXZYaW5sSGQ1QXg4MTNoMlVYZVJpeUdodVhyRW5vUlNZLXpydGJPYktCNG1FRzNZa2JuWHZWaVZH?oc=5
2024-11-14,Celebrate Half-Life 2’s 20th Anniversary With A Tribute Video & A New Look At Half-Life 2 RTX - NVIDIA,https://news.google.com/rss/articles/CBMijAFBVV95cUxOMFR3NFdCZXpyMmhtVEdvSURrc2h6OGhtelB5VGVkNklTT1BWMmpjWXduS01nU0JwRDhRbG55OWk4Xy14eXZjWFZHVkJzUG9UNk1KX3NZa2JJWW80YVRUOTdMSGpYTEdyb3duTDVGcVVrZW84blRSM1otWG1uWnEtc3M5SEh1djZENkd3aA?oc=5
2024-06-02,"NVIDIA Releases Digital Human Microservices, Paving Way for Future of Generative AI Avatars - NVIDIA Newsroom",https://news.google.com/rss/articles/CBMiiAFBVV95cUxOWW9IQ0g4Qm1MLW40TW4wYzVwSWxmZW8xaFM0MGpfejlKQngyY1Jyd3JSQUdkWFE0RkZBZURnN1B2aXJrZVVMazVjT2taaVNHbnVKal9GdTVGZ01XXzh4c091cTBjMEU0Wk42bVJMUzVsQ3N0dHYwWm1SamdxeS1wT3p1UjA3TlEt?oc=5
2024-08-20,"NVIDIA ACE & Digital Human Technologies Showcased In First Game, Mecha BREAK - NVIDIA",https://news.google.com/rss/articles/CBMimwFBVV95cUxPLXZDSy1XSklXNXhSSEdPdHB1SDBCdF9iY0VxN3BuQlFmY3E4blU2RllZQzgxM2xOZ282OXBtZmtMUGpib2xvQkpuYU9qcnpRaXNLbHBOci1pWEtTZWtjV3NqcHpvOENHU25HelFjWEppUzMxdFFFdWkxaFJHZnluaFkzV05LTkVHSjZPaThEckhLVTdwbjAyaGdxUQ?oc=5
2025-03-18,"Half-Life 2 RTX Playable Demo Out Now, NVIDIA RTX Remix Officially Released With DLSS 4 & RTX Neural Shaders - NVIDIA",https://news.google.com/rss/articles/CBMilwFBVV95cUxPZVZZVzZGUkhtOGRLZzZJMks3WjRxRVRTN1RCLUUxc0VwbGl0dkdnNmZvMUs3c01HUWVoczZCSEcyZ1JzaUtRN3RGSE1Kc2RkQy0tcmtHYjFsR1FObXM0Y2xqekxfa2JzZm14UWk1cTA5Sm5Db01hakVEaEJWUmY3MzRYTWloc01zWDVNZzV1a1hkdDZPNEdn?oc=5
2025-01-06,NVIDIA Reflex 2 With New Frame Warp Technology Reduces Latency In Games By Up To 75% - NVIDIA,https://news.google.com/rss/articles/CBMimwFBVV95cUxPNzRzN0JidmtBbXU0ZGlfa21sRjhoNWhTdFJDZ0xMSVJPcHJOZzgwTGhrOFRxSWJfS044dkFZaGNad08taDdMeVgza2MtUEh4bWcxTl9Ua3g2M3UtNkdYcXVDSHo1Qkd5U0R2TWNVd3NITHRxVmtfSVE2NHNxS3YwdGRsSVhRYnVhWjNvUERPYnRpZ1l2YTB6a0swRQ?oc=5
2025-03-25,"Project G-Assist: An AI Assistant For GeForce RTX AI PCs, Is Available Now In NVIDIA App - NVIDIA",https://news.google.com/rss/articles/CBMihgFBVV95cUxPSjRBQU1EeDU1V3VXSWpydDUzbFNEeVVSdXBSNm9pck1uS1VDTDBQaWx4ZVJTa2hFRHNKY3Q2ZXVoZ05LUlNPVFgySFB3LWZ6NXk0c0RiM29ZQWluelV4VXhhMFpfRGFYRHhaZklISDFvVUhST19lTWtFR1hwTS00VGZoVThNZw?oc=5
2024-06-02,Introducing Project G-Assist: A Preview Of How AI Assistants Can Enhance Games & Apps - NVIDIA,https://news.google.com/rss/articles/CBMickFVX3lxTFBVb01odWtOeW9wa2ZnY1ByWEFoMUpFLUliQ0pDZmptbXBVeEE3QUEtYURXOTJ0cldBOS04MllnbC1sMmlXMWV4S3haSTJYVnVTWThnY0RHMnFodHpfQmRCbXVqUkh4dUE1eUhCZ2UyaFdPdw?oc=5
2025-01-06,"Toyota, Aurora and Continental Join Growing List of NVIDIA Partners Rolling Out Next-Generation Highly Automated and Autonomous Vehicle Fleets - NVIDIA Newsroom",https://news.google.com/rss/articles/CBMifkFVX3lxTE5IY2RHUnBMNlFkSndqeUdwczJrWVdPWThKZXRaMlQ5cGJEZmxlR2JIYzJoRUc1RW5FNUgwMkZOSFl0OEdxaDN1MkotWlpFemc4RkxJbF9wXzVjVi10eDlkakpzMnhzb211VGpnZ0Z5a2s4aUZyY1dDTFRmZkVndw?oc=5
2025-01-14,GTC Quantum Day to Illuminate the Future of Quantum Computing - NVIDIA Blog,https://news.google.com/rss/articles/CBMiYEFVX3lxTE41ME94Q2l1R3JnS0dTeTh0d2FTWFU1S3d2RmRGOTFkeDVveFJQTUJvQmVwRGVwbVZJTktLaG1TckdpODB0YmJOTEx0VTF1N1RNME04QXdmYmVVWjhIVTMxYw?oc=5
2025-03-05,NVIDIA CEO Jensen Huang and Industry Visionaries to Unveil What’s Next in AI at GTC 2025 - NVIDIA Newsroom,https://news.google.com/rss/articles/CBMivwFBVV95cUxQSTVkdzJBRVA4SnBielp4SC11MmhtVTRjaV9wOTJrZ2NkaERjQmJmc291Ym1fZnBLRmJSNkpXTjhFVWd2WGZid2JhMW5uOHRnSXRiUlJwUnllWWtlaV9lOV9zUmRILUZMQmpMTHJmaUVZcG9vQ2tIZDJJUGFkcW9fYndERklLOVkxM185UjRYWVo2MG1QWV9hLS1ZaXAyS256SmFhcUdmLWlpTjFzZHBPOHhiaWc4MnRIOEdtVEVnSQ?oc=5
2025-04-15,"Announcing The GeForce RTX 5060 Desktop Family: DLSS 4 Multi Frame Generation, Neural Rendering & Blackwell Innovations For Every Gamer, Starting At $299; Plus RTX 5060 Laptops Available In May - NVIDIA",https://news.google.com/rss/articles/CBMilAFBVV95cUxOamtiV00wNDFoSmZzTDMtOTc4RXRKSzNwSzFBUElDeTNmNFV3Qm9yejVqZkZxdV93eXU1dGlVaUV2eEJYV3Z2bzJjd1RsTlhhVzQ3Vy1BbTVUWFhBU0dOLWJOQ2R0cTdFUFFwOXljNnA1WjRqaU9FR2FCWmZLWFAwLVFlWlljVzVsX0lEQlRwZEdnQTh0?oc=5
2025-05-18,NVIDIA RTX PRO Servers Speed Trillion-Dollar Enterprise IT Industry Transition to AI Factories - NVIDIA Newsroom,https://news.google.com/rss/articles/CBMiyAFBVV95cUxPekp3WnY2UnQxR3FWTUtpejQ2RnJ1a1RzMDlJNkNBOEVtQkpnYkdOR2x0VEZqSjdTMVBIZmJ0VVFEWWF1QmlseUdwT0pLakw0VXpJeGI0UnVaajJkWWd3d1lTZ0hNZXc3NmdHNkpiazJoR3VZYlBGcTkzVk1Uc3pRY3U1OTFRc05rV1VwY1VWOU0tSTk4SFkydlFfdkh4Zjd0TGc1VXhSRjNiSDNiRHRrdnRIa05FemhKUE9rNS1jaFhtRUZwazlVeQ?oc=5
2024-08-20,"GeForce @ Gamescom 2024: ACE Digital Human Technologies Showcased In Mecha BREAK, 20 New RTX Games Announced, G-SYNC Tech Coming to More Gamers, Star Wars™ Outlaws Bundle Launched - NVIDIA",https://news.google.com/rss/articles/CBMijgFBVV95cUxPVnVneGtmRnlXQUNab00xeXotaGRCS2ZuRjRzUFRlNmFlOFdsdHhZOTdTMVNxTmNrVy1BZ0JoVXRib241RG1wSkZfcDlKZ1MtMFBxQmdoSHJjZnlsbk85S0swNGQ2Q21lNXc0TllOMXBma3JhcnJvckdxUktjM2pEZFR1S0I0YW9CdkRKWXhB?oc=5
2025-03-18,Oracle and NVIDIA Collaborate to Help Enterprises Accelerate Agentic AI Inference - NVIDIA Newsroom,https://news.google.com/rss/articles/CBMitwFBVV95cUxPX3A5U29NSmhjMjZpSl9QaGdxc2dsX1VpZlM2WGVldzZ1WXRqWUd0b0VKcVRiZU5vZndHSUtCOTBtRjFHMlkzYmszcXdteVlKa0lJRzhqOFhUa1dPcHFrYkFNQ0YtbHd3MC03bEFxUTBqQTM4MWw3aDRlQy1zRTVTaC0tZFRnQTlUT0lnTXpHUXE5ZnNMdFBKNjMwMm52cW5aWWVINFA1VmVTbUZoQ2I1aE1WRHQ3ejA?oc=5
2025-01-06,NVIDIA Expands Omniverse With Generative Physical AI - NVIDIA Newsroom,https://news.google.com/rss/articles/CBMikAFBVV95cUxORmp5dWF2QUJ4bEhfWmZMZ1V5S09iQlQxcF9LSVVOYUlwSnI4OGlvTHJHNmo1czBHaEJYUTNMcl96YnU4MmRXMENWX29nUF90M1E4cVBoNE8yZ0xUV2tfY0V5RnNhRV9TX0VmTVU1SEk2U0tuY21Od3drblUxeGh4a2YxRFdfUC1yUzdOcndPTmg?oc=5
2025-03-18,NVIDIA to Build Accelerated Quantum Computing Research Center - NVIDIA Newsroom,https://news.google.com/rss/articles/CBMinAFBVV95cUxQRlcxYzlyNTNNbVoyTEcwUE0wZ1RGNERBc05lcjlKVWY4VDI1QXVpNjI3NDMtTS1IazBnd0lRNjJhV2FTaXNxOURvX1RzZzJLVzlaNmpocVpBeWhGV25pd2c2WGxNaTM2cHV6RHFHZGNsY2pXX3BlM1hBZmxaVUZxNG4yM0NHXzRLTDhMeExHQ0NiNThzV0hIRkx1VlU?oc=5
2024-06-02,"GeForce At Computex 2024: Project G-Assist AI Assistant, NVIDIA ACE, Star Wars™ Outlaws Adds DLSS 3.5, SFF-Ready Unveiled, ComfyUI Acceleration, And Much More Announced - NVIDIA",https://news.google.com/rss/articles/CBMijgFBVV95cUxNWlI3OFN3YjZtZ2RsUXJtbTU1U3J1R1RicVBYLUVnbFRjaG52VXZtY2d1ZEJlSjRYcjNmaUNFZ252NW5RMGR4UEdzXy1sVldzU1l4a3BXVTJyTUVJdTE0akRodm0zd0RYMzZaZ1hPRWJGMThlTkN0Z2FQQ2FQWFY1TU1rVG5nZC0yMEVocTJB?oc=5
